{
  "tx_id": "0xfa9538e1f9a2ee35d65760f9dfa79d15e43d38b525b24b724d4edac239ec7a68",
  "sender": "0x1111111111111111111111111111111111111111",
  "recipient": "0x2222222222222222222222222222222222222222",
  "amount": "1.0",
  "chain": "sepolia",
  "status": "confirmed",
  "timestamp": "2026-08-18T10:00:00Z"
}